{"base_images":[{"argument":"NODE_IMAGE","digest":"sha256:2cf067cfed83d5ea958367df9f966191a942351a2df77d6f0193e162b5febfc0","reference":"docker.io/library/node@sha256:2cf067cfed83d5ea958367df9f966191a942351a2df77d6f0193e162b5febfc0","stage":"node_runtime"},{"argument":"PYTHON_IMAGE","digest":"sha256:a116514e19457bcb7af7efe9c3dd0b9b71e85b317694e7882a1c52aa15a78134","reference":"docker.io/library/python@sha256:a116514e19457bcb7af7efe9c3dd0b9b71e85b317694e7882a1c52aa15a78134","stage":"runtime"}],"docker":{"context_transport":"verified_tar_stdin","network_mode":"none","no_cache":true,"pull":false,"shell":false},"external_order_submission_enabled":false,"id":"phase3-python312-node20-offline","installation":{"argv":["python","-m","pip","install","--no-cache-dir","--no-index","--no-deps","--only-binary=:all:","--require-hashes","--find-links=/opt/qt-assurance/wheelhouse","-r","/opt/qt-assurance/requirements.hashed.txt"],"intentionally_unavailable_executables":["psql"],"pip_check_argv":["python","-m","pip","check"]},"platform":{"architecture":"amd64","glibc_max":"2.36","os":"linux","python":"3.12"},"required_image_labels":["com.quant-trad.assurance.source","com.quant-trad.assurance.source-tree","com.quant-trad.assurance.build-profile-sha256","com.quant-trad.assurance.build-definition-sha256","com.quant-trad.assurance.wheel-manifest-sha256","com.quant-trad.assurance.wheel-artifact-sha256","com.quant-trad.assurance.build-context-sha256"],"schema_version":"qt.assurance_runner_build_profile.v1","source_materials":{"dockerfile":"docker/assurance/frontend-node.Dockerfile","materializer":"scripts/assurance/build_runner.py","requirements_lock":"requirements.lock","wheel_manifest":"docker/assurance/python-wheel-manifest.lock.json"},"wheelhouse":{"context_prefix":".qt-assurance-wheelhouse","hashed_requirements_name":"requirements.hashed.txt","manifest_name":"python-wheel-manifest.lock.json"}}
